{
  "id": "oil",
  "type": "ingredient",
  "contentId": "ingredient.oil",
  "slug": {
    "es": "aceite-de-oliva",
    "en": "olive-oil",
    "de": "olivenoel"
  },
  "title": {
    "es": "Aceite de Oliva Virgen Extra",
    "en": "Extra Virgin Olive Oil",
    "de": "Natives Olivenöl Extra"
  },
  "description": {
    "es": "Medio de transmisión térmica y sabor. El AOVE infunde aromas frutales y garantiza una fritura limpia y saludable.",
    "en": "Thermal transmission medium. EVOO infuses fruity aromas and clean frying properties.",
    "de": "Natives Olivenöl Extra verleiht fruchtige Aromen und sorgt für sauberes Frittieren."
  },
  "icon": "Droplet",
  "related": [
    { "type": "ingredient", "id": "potato", "relationship": "confit_medium" },
    { "type": "ingredient", "id": "egg", "relationship": "emulsion_partner" },
    { "type": "ingredient", "id": "salt", "relationship": "solubility_contrast" },
    { "type": "guide", "id": "confit-tecnica-lenta", "relationship": "slow_poaching_science" },
    { "type": "technique", "id": "slow-cooking", "relationship": "thermal_process" },
    { "type": "technique", "id": "emulsion", "relationship": "chemical_process" },
    { "type": "recipe", "id": "clasica", "relationship": "featured_recipe" },
    { "type": "recipe", "id": "betanzos", "relationship": "featured_recipe" },
    { "type": "history", "id": "history", "relationship": "cooperatives_culture" }
  ]
}
