{
  "id": "onion",
  "type": "ingredient",
  "contentId": "ingredient.onion",
  "slug": {
    "es": "cebolla",
    "en": "onion",
    "de": "zwiebel"
  },
  "title": {
    "es": "Cebolla",
    "en": "Onion",
    "de": "Zwiebel"
  },
  "description": {
    "es": "Eje del gran debate nacional. Pochada a fuego lento, aporta dulzor natural y melosidad incomparable.",
    "en": "Center of Spain's culinary debate. Poached slowly, it adds natural sweetness and rich texture.",
    "de": "Hauptthema des kulinarischen Debatte. Langsam gedünstet verleiht sie natürliche Süße und Saftigkeit."
  },
  "icon": "Flame",
  "related": [
    { "type": "ingredient", "id": "potato", "relationship": "pairing" },
    { "type": "ingredient", "id": "oil", "relationship": "confit_medium" },
    { "type": "ingredient", "id": "salt", "relationship": "osmotic_breakdown" },
    { "type": "guide", "id": "debate-cebolla-ciencia-sabor", "relationship": "culinary_debate" },
    { "type": "guide", "id": "masterclass-cebolla-caramelizada", "relationship": "caramelization_science" },
    { "type": "recipe", "id": "con-cebolla", "relationship": "featured_recipe" }
  ]
}
